{
  "schema_version": "disk-organiser/manual-storage-plan/v1",
  "document_id": "plan_00000000-0000-0000-0000-000000000001",
  "title": "My storage plan",
  "revision": 1,
  "created_at": "2026-10-09T04:40:00Z",
  "updated_at": "2026-10-09T04:40:00Z",
  "drives": [],
  "items": [],
  "projects": [],
  "backup_targets": [],
  "protection_plans": [],
  "restore_plans": []
}
